{
  "goal": "Keep hydra-claw-loop coherent and progressing",
  "active_context": [],
  "recent_events": [],
  "current_actions": [
    "act-5ad1aade-6175-4ceb-9415-2e6e4812063e"
  ],
  "open_loops": [
    "loop-evt-6b2c86e3-3c72-4faa-9b38-ef43890414bf"
  ],
  "last_verified_result": {
    "action_id": "act-5ad1aade-6175-4ceb-9415-2e6e4812063e",
    "status": "success",
    "summary": "Messaging task queued (approval required): telegram to @sidonsoft",
    "evidence": [
      "evt-6b2c86e3-3c72-4faa-9b38-ef43890414bf",
      "act-5ad1aade-6175-4ceb-9415-2e6e4812063e",
      "/Users/burnz/.openclaw/workspace/hydra-claw-loop/runs/messaging_tasks/act-5ad1aade-6175-4ceb-9415-2e6e4812063e/task.json",
      "/Users/burnz/.openclaw/workspace/hydra-claw-loop/runs/messaging_tasks/act-5ad1aade-6175-4ceb-9415-2e6e4812063e/execution.json"
    ],
    "artifacts": [
      "runs/messaging_tasks/act-5ad1aade-6175-4ceb-9415-2e6e4812063e/task.json",
      "runs/messaging_tasks/act-5ad1aade-6175-4ceb-9415-2e6e4812063e/brief.md",
      "runs/messaging_tasks/act-5ad1aade-6175-4ceb-9415-2e6e4812063e/execution.json",
      "state/recent_changes.md"
    ],
    "follow_up": [],
    "verified": true
  }
}
